{
  "$schema": "https://json-schema.org/draft/2020-12/schema",
  "$id": "https://autocomp.local/schemas/autocomp-vision-mission.schema.json",
  "title": "AUTOComp universal vision mission",
  "type": "object",
  "additionalProperties": false,
  "required": ["schema_version", "objective", "context", "goals"],
  "properties": {
    "schema_version": {"const": 1},
    "objective": {"type": "string", "minLength": 1},
    "context": {"type": "string"},
    "goals": {
      "type": "array",
      "minItems": 1,
      "items": {
        "type": "object",
        "additionalProperties": false,
        "required": ["id", "objective", "context", "success_criteria", "allowed_text"],
        "properties": {
          "id": {
            "type": "string",
            "pattern": "^[A-Za-z0-9][A-Za-z0-9_.-]{0,127}$"
          },
          "objective": {"type": "string", "minLength": 1},
          "context": {"type": "string"},
          "success_criteria": {
            "type": "array",
            "minItems": 1,
            "items": {"type": "string", "minLength": 1}
          },
          "allowed_text": {
            "type": "array",
            "items": {
              "type": "object",
              "additionalProperties": false,
              "required": ["original", "english", "russian"],
              "properties": {
                "original": {"type": "string", "minLength": 1, "maxLength": 512},
                "english": {
                  "oneOf": [
                    {"type": "string", "minLength": 1, "maxLength": 512},
                    {"type": "null"}
                  ]
                },
                "russian": {
                  "oneOf": [
                    {"type": "string", "minLength": 1, "maxLength": 512},
                    {"type": "null"}
                  ]
                }
              }
            }
          }
        }
      }
    }
  }
}
